{
  "_generated": "GENERATED — do not hand-edit. figma-synced 2026-10-21T12:25:27.000Z; regenerated by atlas-figma-sync.",
  "name": "Toast",
  "tier": "compositions",
  "status": "stable",
  "deprecated": null,
  "owner": "@rizwan-uxd",
  "import": "@atlas/ui-web/compositions/Toast/Toast",
  "variants": ["default", "success", "danger"],
  "sizes": [],
  "props": [
    { "name": "variant", "required": false, "type": "ToastVariant" },
    { "name": "icon", "required": false, "type": "React.ReactNode | boolean" }
  ],
  "subcomponents": ["ToastProvider", "ToastViewport", "ToastTitle", "ToastDescription", "ToastAction", "ToastClose", "Toaster"],
  "tokensUsed": ["--atlas-border", "--atlas-border-width-1", "--atlas-content-width-md", "--atlas-danger", "--atlas-danger-muted", "--atlas-danger-subtle", "--atlas-duration-slow", "--atlas-font-sans", "--atlas-foreground", "--atlas-foreground-muted", "--atlas-motion-enter-duration", "--atlas-motion-enter-easing", "--atlas-motion-exit-duration", "--atlas-motion-exit-easing", "--atlas-motion-exit-quick-duration", "--atlas-motion-exit-quick-easing", "--atlas-motion-state-duration", "--atlas-motion-state-easing", "--atlas-radius-2xl", "--atlas-shadow-floating", "--atlas-spacing-2", "--atlas-spacing-3", "--atlas-spacing-4", "--atlas-spacing-8", "--atlas-spacing-section-gap", "--atlas-spacing-surface-padding", "--atlas-spacing-text-gap", "--atlas-success", "--atlas-success-muted", "--atlas-success-subtle", "--atlas-surface-raised", "--atlas-type-caption-line-height", "--atlas-type-caption-size", "--atlas-type-caption-weight", "--atlas-type-label-line-height", "--atlas-type-label-size", "--atlas-type-label-weight", "--atlas-z-toast"],
  "figmaNodeId": "670:68",
  "figmaFileKey": "cKYhfaHLCoyMHi9nKr63Ig",
  "figmaProperties": { "Variant": ["default", "success", "danger"] },
  "syncedAt": "2026-10-21T12:25:27.000Z",
  "figmaVersion": "lib:Atlas Design System v1@2026-07-06T03:44:45Z",
  "source": "figma-synced"
}
