{
  "_generated": "GENERATED — do not hand-edit. figma-synced 2026-10-21T12:25:27.000Z; regenerated by atlas-figma-sync.",
  "name": "Switch",
  "tier": "primitives",
  "status": "stable",
  "deprecated": null,
  "owner": "@rizwan-uxd",
  "import": "@atlas/ui-web/primitives/Switch/Switch",
  "variants": [],
  "sizes": ["sm", "md", "lg"],
  "props": [
    { "name": "size", "required": false, "type": "SwitchSize" },
    { "name": "checked", "required": false, "type": "boolean" },
    { "name": "defaultChecked", "required": false, "type": "boolean" },
    { "name": "onCheckedChange", "required": false, "type": "(checked: boolean) => void" },
    { "name": "disabled", "required": false, "type": "boolean" },
    { "name": "invalid", "required": false, "type": "boolean" },
    { "name": "label", "required": false, "type": "React.ReactNode" },
    { "name": "description", "required": false, "type": "React.ReactNode" },
    { "name": "required", "required": false, "type": "boolean" },
    { "name": "id", "required": false, "type": "string" }
  ],
  "subcomponents": [],
  "tokensUsed": ["--atlas-background", "--atlas-border-width-2", "--atlas-danger", "--atlas-duration-base", "--atlas-duration-fast", "--atlas-easing-emphasized", "--atlas-easing-standard", "--atlas-focus-ring", "--atlas-font-sans", "--atlas-font-size-sm", "--atlas-font-size-xs", "--atlas-font-weight-medium", "--atlas-foreground-on-brand", "--atlas-line-height-snug", "--atlas-opacity-disabled", "--atlas-radius-full", "--atlas-shadow-sm", "--atlas-spacing-0_5", "--atlas-spacing-1", "--atlas-spacing-10", "--atlas-spacing-3", "--atlas-spacing-4", "--atlas-spacing-5", "--atlas-spacing-6", "--atlas-spacing-9", "--atlas-switch-checked-track-background", "--atlas-switch-checked-track-background-active", "--atlas-switch-checked-track-background-hover", "--atlas-switch-description-foreground", "--atlas-switch-gap", "--atlas-switch-label-foreground", "--atlas-switch-size-lg-height", "--atlas-switch-size-lg-thumb", "--atlas-switch-size-md-height", "--atlas-switch-size-md-thumb", "--atlas-switch-size-sm-height", "--atlas-switch-size-sm-thumb", "--atlas-switch-thumb-background", "--atlas-switch-track-background", "--atlas-switch-track-background-active", "--atlas-switch-track-background-hover", "--atlas-touch-min"],
  "figmaNodeId": "95:114",
  "figmaFileKey": "cKYhfaHLCoyMHi9nKr63Ig",
  "figmaProperties": { "Checked": ["off", "on"], "Size": ["sm", "md", "lg"], "State": ["default", "hover", "focus-visible", "active", "disabled"] },
  "syncedAt": "2026-10-21T12:25:27.000Z",
  "figmaVersion": "lib:Atlas Design System v1@2026-07-06T03:44:45Z",
  "source": "figma-synced"
}
