{
  "_generated": "GENERATED — do not hand-edit. figma-synced 2026-10-21T12:25:27.000Z; regenerated by atlas-figma-sync.",
  "name": "Progress",
  "tier": "primitives",
  "status": "stable",
  "deprecated": null,
  "import": "@atlas/ui-web/primitives/Progress/Progress",
  "variants": [],
  "sizes": [],
  "props": [
    { "name": "value", "required": false, "type": "number" },
    { "name": "max", "required": false, "type": "number" },
    { "name": "indeterminate", "required": false, "type": "boolean" },
    { "name": "label", "required": false, "type": "React.ReactNode" },
    { "name": "valueLabel", "required": false, "type": "React.ReactNode" },
    { "name": "helperText", "required": false, "type": "React.ReactNode" },
    { "name": "aria-valuetext", "required": false, "type": "string" },
    { "name": "aria-label", "required": false, "type": "string" },
    { "name": "aria-labelledby", "required": false, "type": "string" },
    { "name": "aria-describedby", "required": false, "type": "string" }
  ],
  "subcomponents": [],
  "tokensUsed": ["--atlas-background-muted", "--atlas-duration-base", "--atlas-duration-pulse", "--atlas-easing-linear", "--atlas-easing-standard", "--atlas-font-sans", "--atlas-font-weight-medium", "--atlas-font-weight-regular", "--atlas-foreground", "--atlas-foreground-muted", "--atlas-line-height-normal", "--atlas-primary", "--atlas-radius-full", "--atlas-spacing-1", "--atlas-spacing-2", "--atlas-text-body-sm", "--atlas-text-caption"],
  "figmaNodeId": "541:28",
  "figmaFileKey": "cKYhfaHLCoyMHi9nKr63Ig",
  "figmaProperties": { "State": ["determinate", "indeterminate"], "Percent": ["50", "0", "10", "20", "30", "40", "60", "70", "80", "90", "100"] },
  "syncedAt": "2026-10-21T12:25:27.000Z",
  "figmaVersion": "lib:Atlas Design System v1@2026-07-06T03:44:45Z",
  "source": "figma-synced"
}
