{
  "_generated": "GENERATED — do not hand-edit. figma-synced 2026-10-21T12:25:27.000Z; regenerated by atlas-figma-sync.",
  "name": "Spinner",
  "tier": "primitives",
  "status": "stable",
  "deprecated": null,
  "owner": "@rizwan-uxd",
  "import": "@atlas/ui-web/primitives/Spinner/Spinner",
  "variants": ["default", "custom"],
  "sizes": ["xs", "sm", "md", "lg"],
  "props": [
    { "name": "variant", "required": false, "type": "SpinnerVariant" },
    { "name": "size", "required": false, "type": "SpinnerSize" },
    { "name": "label", "required": false, "type": "string" }
  ],
  "subcomponents": [],
  "tokensUsed": ["--atlas-duration-spin", "--atlas-easing-linear", "--atlas-icon-size-lg", "--atlas-icon-size-md", "--atlas-icon-size-sm", "--atlas-icon-size-xs", "--atlas-icon-stroke-lg", "--atlas-icon-stroke-md", "--atlas-icon-stroke-sm", "--atlas-icon-stroke-xs"],
  "figmaNodeId": "527:63",
  "figmaFileKey": "cKYhfaHLCoyMHi9nKr63Ig",
  "figmaProperties": { "Variant": ["default", "custom"], "Size": ["xs", "sm", "md", "lg"] },
  "syncedAt": "2026-10-21T12:25:27.000Z",
  "figmaVersion": "lib:Atlas Design System v1@2026-07-06T03:44:45Z",
  "source": "figma-synced"
}
