{
  "_generated": "GENERATED — do not hand-edit. figma-synced 2026-10-21T12:25:27.000Z; regenerated by atlas-figma-sync.",
  "name": "ListItem",
  "tier": "compositions",
  "status": "stable",
  "deprecated": null,
  "import": "@atlas/ui-web/compositions/ListItem/ListItem",
  "variants": ["default", "outline", "muted"],
  "sizes": ["sm", "md"],
  "props": [
    { "name": "direction", "required": false, "type": "ListItemDirection" },
    { "name": "variant", "required": false, "type": "ListItemVariant" },
    { "name": "size", "required": false, "type": "ListItemSize" },
    { "name": "as", "required": false, "type": "\"div\" | \"li\"" },
    { "name": "children", "required": false, "type": "React.ReactNode" }
  ],
  "subcomponents": ["ListItemMedia", "ListItemContent", "ListItemTitle", "ListItemDescription", "ListItemActions"],
  "tokensUsed": ["--atlas-background-muted", "--atlas-border", "--atlas-border-width-1", "--atlas-font-sans", "--atlas-font-size-sm", "--atlas-font-size-xs", "--atlas-font-weight-medium", "--atlas-foreground", "--atlas-foreground-muted", "--atlas-icon-size-xs", "--atlas-line-height-normal", "--atlas-line-height-snug", "--atlas-radius-lg", "--atlas-radius-md", "--atlas-radius-sm", "--atlas-spacing-0_5", "--atlas-spacing-10", "--atlas-spacing-2", "--atlas-spacing-3", "--atlas-spacing-6", "--atlas-spacing-8", "--atlas-spacing-px"],
  "figmaNodeId": "505:124",
  "figmaFileKey": "cKYhfaHLCoyMHi9nKr63Ig",
  "figmaProperties": { "Direction": ["horizontal", "vertical"], "Variant": ["default", "outline", "muted"], "Size": ["sm", "md"] },
  "syncedAt": "2026-10-21T12:25:27.000Z",
  "figmaVersion": "lib:Atlas Design System v1@2026-07-06T03:44:45Z",
  "source": "figma-synced"
}
