{
  "_generated": "GENERATED — do not hand-edit. figma-synced 2026-10-21T12:25:27.000Z; regenerated by atlas-figma-sync.",
  "name": "Stepper",
  "tier": "patterns",
  "status": "stable",
  "deprecated": null,
  "owner": "@rizwan-uxd",
  "import": "@atlas/ui-web/patterns/Stepper/Stepper",
  "variants": [],
  "sizes": [],
  "props": [
    { "name": "steps", "required": true, "type": "StepperStep[]" },
    { "name": "current", "required": true, "type": "number" },
    { "name": "orientation", "required": false, "type": "StepperOrientation" }
  ],
  "subcomponents": [],
  "tokensUsed": ["--atlas-background", "--atlas-background-muted", "--atlas-border", "--atlas-border-width-1", "--atlas-border-width-2", "--atlas-font-sans", "--atlas-font-size-base", "--atlas-font-size-sm", "--atlas-font-size-xs", "--atlas-font-weight-medium", "--atlas-font-weight-semibold", "--atlas-foreground", "--atlas-foreground-muted", "--atlas-line-height-normal", "--atlas-primary", "--atlas-primary-foreground", "--atlas-radius-pill", "--atlas-spacing-1", "--atlas-spacing-10", "--atlas-spacing-12", "--atlas-spacing-3", "--atlas-spacing-4", "--atlas-spacing-5", "--atlas-spacing-6", "--atlas-spacing-8", "--atlas-spacing-control-gap", "--atlas-spacing-item-gap", "--atlas-type-caption-line-height", "--atlas-type-caption-size", "--atlas-type-caption-weight", "--atlas-type-label-line-height", "--atlas-type-label-size", "--atlas-type-label-weight"],
  "figmaNodeId": "984:3356",
  "figmaFileKey": "cKYhfaHLCoyMHi9nKr63Ig",
  "figmaProperties": { "Orientation": ["horizontal", "vertical"], "Viewport": ["mobile", "tablet", "desktop"], "Steps": ["3", "4", "5"], "Current": ["1", "2", "3", "4", "5"] },
  "syncedAt": "2026-10-21T12:25:27.000Z",
  "figmaVersion": "lib:Atlas Design System v1@2026-07-06T03:44:45Z",
  "source": "figma-synced"
}
