{
  "_generated": "GENERATED — do not hand-edit. figma-synced 2026-10-21T12:25:27.000Z; regenerated by atlas-figma-sync.",
  "name": "Field",
  "tier": "compositions",
  "status": "stable",
  "deprecated": null,
  "owner": "@rizwan-uxd",
  "import": "@atlas/ui-web/compositions/Field/Field",
  "variants": [],
  "sizes": ["sm", "md", "lg"],
  "props": [
    { "name": "size", "required": false, "type": "FieldSize" },
    { "name": "label", "required": true, "type": "React.ReactNode" },
    { "name": "required", "required": false, "type": "boolean" },
    { "name": "optional", "required": false, "type": "boolean" },
    { "name": "helpText", "required": false, "type": "React.ReactNode" },
    { "name": "error", "required": false, "type": "React.ReactNode" },
    { "name": "disabled", "required": false, "type": "boolean" },
    { "name": "id", "required": false, "type": "string" },
    { "name": "labelAction", "required": false, "type": "React.ReactNode" },
    { "name": "children", "required": true, "type": "(control: FieldControlProps) => React.ReactNode" }
  ],
  "subcomponents": [],
  "tokensUsed": ["--atlas-danger", "--atlas-font-sans", "--atlas-font-size-sm", "--atlas-font-size-xs", "--atlas-font-weight-regular", "--atlas-foreground-disabled", "--atlas-foreground-muted", "--atlas-icon-size-xs", "--atlas-icon-stroke-xs", "--atlas-line-height-normal", "--atlas-spacing-1_5", "--atlas-spacing-2"],
  "figmaNodeId": "863:254",
  "figmaFileKey": "cKYhfaHLCoyMHi9nKr63Ig",
  "figmaProperties": { "Size": ["sm", "md", "lg"] },
  "syncedAt": "2026-10-21T12:25:27.000Z",
  "figmaVersion": "lib:Atlas Design System v1@2026-07-06T03:44:45Z",
  "source": "figma-synced"
}
