{
  "_generated": "GENERATED — do not hand-edit. figma-synced 2026-10-21T12:25:27.000Z; regenerated by atlas-figma-sync.",
  "name": "Divider",
  "tier": "primitives",
  "status": "stable",
  "deprecated": null,
  "import": "@atlas/ui-web/primitives/Divider/Divider",
  "variants": [],
  "sizes": [],
  "props": [
    { "name": "orientation", "required": false, "type": "DividerOrientation" },
    { "name": "tone", "required": false, "type": "DividerTone" },
    { "name": "decorative", "required": false, "type": "boolean" }
  ],
  "subcomponents": [],
  "tokensUsed": ["--atlas-border", "--atlas-border-inverse", "--atlas-border-strong", "--atlas-border-subtle", "--atlas-border-width-1"],
  "figmaNodeId": "498:11",
  "figmaFileKey": "cKYhfaHLCoyMHi9nKr63Ig",
  "figmaProperties": { "Orientation": ["horizontal", "vertical"], "Tone": ["default", "strong", "subtle", "inverse"] },
  "syncedAt": "2026-10-21T12:25:27.000Z",
  "figmaVersion": "lib:Atlas Design System v1@2026-07-06T03:44:45Z",
  "source": "figma-synced"
}
