{
  "_generated": "GENERATED — do not hand-edit. figma-synced 2026-10-21T12:25:27.000Z; regenerated by atlas-figma-sync.",
  "name": "Drawer",
  "tier": "compositions",
  "status": "stable",
  "deprecated": null,
  "owner": "@rizwan-uxd",
  "import": "@atlas/ui-web/compositions/Drawer/Drawer",
  "variants": [],
  "sizes": ["sm", "md", "lg", "xl", "full"],
  "props": [],
  "subcomponents": ["DrawerContent"],
  "tokensUsed": ["--atlas-border", "--atlas-border-width-1", "--atlas-dialog-lg", "--atlas-dialog-md", "--atlas-dialog-sm", "--atlas-dialog-xl", "--atlas-duration-base", "--atlas-duration-fast", "--atlas-easing-emphasized", "--atlas-easing-exit", "--atlas-easing-standard", "--atlas-font-sans", "--atlas-overlay", "--atlas-radius-lg", "--atlas-safe-top", "--atlas-shadow-xl", "--atlas-spacing-4", "--atlas-spacing-6", "--atlas-spacing-8", "--atlas-surface-overlay", "--atlas-z-modal", "--atlas-z-overlay"],
  "figmaNodeId": "577:24",
  "figmaFileKey": "cKYhfaHLCoyMHi9nKr63Ig",
  "figmaProperties": { "Side": ["start", "end"] },
  "syncedAt": "2026-10-21T12:25:27.000Z",
  "figmaVersion": "lib:Atlas Design System v1@2026-07-06T03:44:45Z",
  "source": "figma-synced"
}
