{
  "_generated": "GENERATED — do not hand-edit. figma-synced 2026-10-21T12:25:27.000Z; regenerated by atlas-figma-sync.",
  "name": "Select",
  "tier": "primitives",
  "status": "stable",
  "deprecated": null,
  "owner": "@rizwan-uxd",
  "import": "@atlas/ui-web/primitives/Select/Select",
  "variants": [],
  "sizes": ["sm", "md"],
  "props": [
    { "name": "value", "required": false, "type": "string" },
    { "name": "defaultValue", "required": false, "type": "string" },
    { "name": "onValueChange", "required": false, "type": "(value: string) => void" },
    { "name": "name", "required": false, "type": "string" },
    { "name": "required", "required": false, "type": "boolean" },
    { "name": "disabled", "required": false, "type": "boolean" },
    { "name": "children", "required": false, "type": "React.ReactNode" }
  ],
  "subcomponents": ["SelectTrigger", "SelectValue", "SelectContent", "SelectItem", "SelectGroup", "SelectLabel", "SelectSeparator"],
  "tokensUsed": ["--atlas-border-width-1", "--atlas-border-width-2", "--atlas-focus-ring", "--atlas-font-sans", "--atlas-icon-size-xs", "--atlas-motion-state-duration", "--atlas-motion-state-easing", "--atlas-opacity-disabled", "--atlas-radius-item", "--atlas-select-background", "--atlas-select-background-disabled", "--atlas-select-border", "--atlas-select-border-focus", "--atlas-select-border-hover", "--atlas-select-border-invalid", "--atlas-select-chevron-foreground", "--atlas-select-content-background", "--atlas-select-content-border", "--atlas-select-content-foreground", "--atlas-select-content-radius", "--atlas-select-foreground", "--atlas-select-foreground-disabled", "--atlas-select-item-background-focus", "--atlas-select-item-foreground", "--atlas-select-item-indicator-foreground", "--atlas-select-label-foreground", "--atlas-select-placeholder-foreground", "--atlas-select-radius", "--atlas-select-size-md-font-size", "--atlas-select-size-md-gap", "--atlas-select-size-md-height", "--atlas-select-size-md-padding-inline-end", "--atlas-select-size-md-padding-inline-start", "--atlas-select-size-sm-font-size", "--atlas-select-size-sm-gap", "--atlas-select-size-sm-height", "--atlas-select-size-sm-padding-inline-end", "--atlas-select-size-sm-padding-inline-start", "--atlas-shadow-md", "--atlas-spacing-1", "--atlas-spacing-1_5", "--atlas-spacing-2", "--atlas-spacing-4", "--atlas-spacing-8", "--atlas-spacing-control-gap", "--atlas-spacing-focus-offset", "--atlas-spacing-item-padding", "--atlas-spacing-overlay-offset", "--atlas-touch-min", "--atlas-type-body-sm-line-height", "--atlas-type-body-sm-size", "--atlas-type-body-sm-weight", "--atlas-type-overline-letter-spacing", "--atlas-type-overline-line-height", "--atlas-type-overline-size", "--atlas-type-overline-weight", "--atlas-z-dropdown"],
  "figmaNodeId": "630:75",
  "figmaFileKey": "cKYhfaHLCoyMHi9nKr63Ig",
  "figmaProperties": { "Size": ["sm", "md"], "State": ["default", "hover", "focus", "open", "disabled", "invalid"], "Placeholder": ["true", "false"] },
  "syncedAt": "2026-10-21T12:25:27.000Z",
  "figmaVersion": "lib:Atlas Design System v1@2026-07-06T03:44:45Z",
  "source": "figma-synced"
}
