{
  "_generated": "GENERATED — do not hand-edit. figma-synced 2026-10-21T12:25:27.000Z; regenerated by atlas-figma-sync.",
  "name": "EmptyState",
  "tier": "compositions",
  "status": "stable",
  "deprecated": null,
  "owner": "@rizwan-uxd",
  "import": "@atlas/ui-web/compositions/EmptyState/EmptyState",
  "variants": [],
  "sizes": ["sm", "md", "lg"],
  "props": [
    { "name": "size", "required": false, "type": "EmptyStateSize" },
    { "name": "icon", "required": false, "type": "React.ReactNode" },
    { "name": "title", "required": false, "type": "React.ReactNode" },
    { "name": "description", "required": false, "type": "React.ReactNode" },
    { "name": "action", "required": false, "type": "React.ReactNode" },
    { "name": "secondaryAction", "required": false, "type": "React.ReactNode" },
    { "name": "className", "required": false, "type": "string" }
  ],
  "subcomponents": [],
  "tokensUsed": ["--atlas-font-sans", "--atlas-font-weight-regular", "--atlas-font-weight-semibold", "--atlas-foreground", "--atlas-foreground-muted", "--atlas-foreground-subtle", "--atlas-icon-size-lg", "--atlas-icon-size-md", "--atlas-icon-stroke-lg", "--atlas-icon-stroke-md", "--atlas-line-height-normal", "--atlas-line-height-snug", "--atlas-spacing-12", "--atlas-spacing-3", "--atlas-spacing-6", "--atlas-spacing-section-gap", "--atlas-spacing-surface-padding-lg", "--atlas-text-body", "--atlas-text-body-sm", "--atlas-text-h2", "--atlas-text-h3", "--atlas-text-h4"],
  "figmaNodeId": "858:60",
  "figmaFileKey": "cKYhfaHLCoyMHi9nKr63Ig",
  "figmaProperties": { "Size": ["sm", "md", "lg"] },
  "syncedAt": "2026-10-21T12:25:27.000Z",
  "figmaVersion": "lib:Atlas Design System v1@2026-07-06T03:44:45Z",
  "source": "figma-synced"
}
