{
  "_generated": "GENERATED — do not hand-edit. figma-synced 2026-10-21T12:25:27.000Z; regenerated by atlas-figma-sync.",
  "name": "Breadcrumb",
  "tier": "patterns",
  "status": "stable",
  "deprecated": null,
  "owner": "@rizwan-uxd",
  "import": "@atlas/ui-web/patterns/Breadcrumb/Breadcrumb",
  "variants": [],
  "sizes": [],
  "props": [
    { "name": "separator", "required": false, "type": "BreadcrumbSeparatorStyle" }
  ],
  "subcomponents": ["BreadcrumbList", "BreadcrumbItem", "BreadcrumbLink", "BreadcrumbPage", "BreadcrumbSeparator", "BreadcrumbEllipsis", "BreadcrumbDropdown"],
  "tokensUsed": ["--atlas-background", "--atlas-border-width-2", "--atlas-focus-ring", "--atlas-font-sans", "--atlas-foreground", "--atlas-foreground-muted", "--atlas-icon-size-xs", "--atlas-motion-state-duration", "--atlas-motion-state-easing", "--atlas-primary", "--atlas-radius-control", "--atlas-radius-item", "--atlas-spacing-0", "--atlas-spacing-1_5", "--atlas-spacing-6", "--atlas-spacing-item-gap", "--atlas-touch-min", "--atlas-type-body-sm-line-height", "--atlas-type-body-sm-size", "--atlas-type-body-sm-weight"],
  "figmaNodeId": "493:75",
  "figmaFileKey": "cKYhfaHLCoyMHi9nKr63Ig",
  "figmaProperties": { "Separator": ["chevron", "dot"] },
  "syncedAt": "2026-10-21T12:25:27.000Z",
  "figmaVersion": "lib:Atlas Design System v1@2026-07-06T03:44:45Z",
  "source": "figma-synced"
}
