{
  "_generated": "GENERATED — do not hand-edit. figma-synced 2026-10-21T12:25:27.000Z; regenerated by atlas-figma-sync.",
  "name": "Pagination",
  "tier": "patterns",
  "status": "stable",
  "deprecated": null,
  "import": "@atlas/ui-web/patterns/Pagination/Pagination",
  "variants": [],
  "sizes": ["sm", "md"],
  "props": [
    { "name": "page", "required": true, "type": "number" },
    { "name": "pageCount", "required": true, "type": "number" },
    { "name": "onPageChange", "required": true, "type": "(page: number) => void" },
    { "name": "siblingCount", "required": false, "type": "number" },
    { "name": "size", "required": false, "type": "PaginationSize" },
    { "name": "disabled", "required": false, "type": "boolean" }
  ],
  "subcomponents": [],
  "tokensUsed": ["--atlas-button-size-md-height", "--atlas-button-size-sm-height", "--atlas-foreground-muted", "--atlas-icon-size-xs", "--atlas-spacing-1"],
  "figmaNodeId": "903:537",
  "figmaFileKey": "cKYhfaHLCoyMHi9nKr63Ig",
  "figmaProperties": { "Size": ["sm", "md"], "Position": ["start", "middle", "end"] },
  "syncedAt": "2026-10-21T12:25:27.000Z",
  "figmaVersion": "lib:Atlas Design System v1@2026-07-06T03:44:45Z",
  "source": "figma-synced"
}
