{
  "_generated": "GENERATED — do not hand-edit. figma-synced 2026-10-21T12:25:27.000Z; regenerated by atlas-figma-sync.",
  "name": "CommandMenu",
  "tier": "compositions",
  "status": "stable",
  "deprecated": null,
  "owner": "@rizwan-uxd",
  "import": "@atlas/ui-web/compositions/CommandMenu/CommandMenu",
  "variants": [],
  "sizes": ["md", "lg"],
  "props": [
    { "name": "open", "required": false, "type": "boolean" },
    { "name": "defaultOpen", "required": false, "type": "boolean" },
    { "name": "onOpenChange", "required": false, "type": "(open: boolean) => void" },
    { "name": "hotkey", "required": false, "type": "string | false" },
    { "name": "children", "required": false, "type": "React.ReactNode" }
  ],
  "subcomponents": ["CommandMenuContent", "CommandMenuGroup", "CommandMenuItem"],
  "tokensUsed": ["--atlas-background-accent", "--atlas-border-width-2", "--atlas-font-size-sm", "--atlas-font-weight-medium", "--atlas-foreground", "--atlas-foreground-muted", "--atlas-icon-size-xs", "--atlas-opacity-disabled", "--atlas-radius-item", "--atlas-spacing-1", "--atlas-spacing-10", "--atlas-spacing-1_5", "--atlas-spacing-2", "--atlas-spacing-6", "--atlas-spacing-control-gap", "--atlas-spacing-item-padding", "--atlas-type-overline-letter-spacing", "--atlas-type-overline-line-height", "--atlas-type-overline-size", "--atlas-type-overline-weight"],
  "figmaNodeId": "990:211",
  "figmaFileKey": "cKYhfaHLCoyMHi9nKr63Ig",
  "figmaProperties": { "Size": ["md", "lg"], "State": ["default", "empty", "loading"] },
  "syncedAt": "2026-10-21T12:25:27.000Z",
  "figmaVersion": "lib:Atlas Design System v1@2026-07-06T03:44:45Z",
  "source": "figma-synced"
}
