{
  "_generated": "GENERATED — do not hand-edit. figma-synced 2026-10-21T12:25:27.000Z; regenerated by atlas-figma-sync.",
  "name": "ScrollProgress",
  "tier": "primitives",
  "status": "stable",
  "deprecated": null,
  "owner": "@rizwan-uxd",
  "import": "@atlas/ui-web/primitives/ScrollProgress/ScrollProgress",
  "variants": [],
  "sizes": [],
  "props": [
    { "name": "orientation", "required": false, "type": "ScrollProgressOrientation" },
    { "name": "scope", "required": false, "type": "ScrollProgressScope" },
    { "name": "target", "required": false, "type": "React.RefObject<HTMLElement | null>" },
    { "name": "axis", "required": false, "type": "ScrollProgressAxis" }
  ],
  "subcomponents": [],
  "tokensUsed": ["--atlas-background-muted", "--atlas-duration-fast", "--atlas-easing-standard", "--atlas-primary", "--atlas-radius-full", "--atlas-radius-none", "--atlas-spacing-1", "--atlas-z-sticky"],
  "figmaNodeId": "734:27",
  "figmaFileKey": "cKYhfaHLCoyMHi9nKr63Ig",
  "figmaProperties": { "Orientation": ["horizontal", "vertical"], "Scope": ["page", "container"], "Progress": ["0", "50", "100"] },
  "syncedAt": "2026-10-21T12:25:27.000Z",
  "figmaVersion": "lib:Atlas Design System v1@2026-07-06T03:44:45Z",
  "source": "figma-synced"
}
