{
  "_generated": "GENERATED — do not hand-edit. figma-synced 2026-10-21T12:25:27.000Z; regenerated by atlas-figma-sync.",
  "name": "Card",
  "tier": "compositions",
  "status": "stable",
  "deprecated": null,
  "owner": "@rizwan-uxd",
  "import": "@atlas/ui-web/compositions/Card/Card",
  "variants": ["default", "elevated", "outlined", "filled"],
  "sizes": ["sm", "md", "lg"],
  "props": [
    { "name": "variant", "required": false, "type": "CardVariant" },
    { "name": "size", "required": false, "type": "CardSize" },
    { "name": "interactive", "required": false, "type": "boolean" },
    { "name": "selected", "required": false, "type": "boolean" },
    { "name": "disabled", "required": false, "type": "boolean" },
    { "name": "aria-label", "required": false, "type": "string" },
    { "name": "onClick", "required": false, "type": "React.MouseEventHandler<HTMLElement>" },
    { "name": "className", "required": false, "type": "string" },
    { "name": "children", "required": false, "type": "React.ReactNode" },
    { "name": "id", "required": false, "type": "string" }
  ],
  "subcomponents": ["CardHeader", "CardTitle", "CardDescription", "CardContent", "CardFooter"],
  "tokensUsed": ["--atlas-background", "--atlas-background-subtle", "--atlas-border-width-1", "--atlas-border-width-2", "--atlas-card-default-background", "--atlas-card-default-border", "--atlas-card-description-foreground", "--atlas-card-elevated-background", "--atlas-card-elevated-shadow", "--atlas-card-elevated-shadow-hover", "--atlas-card-filled-background", "--atlas-card-filled-background-hover", "--atlas-card-outlined-background", "--atlas-card-outlined-border", "--atlas-card-radius", "--atlas-card-selected-background", "--atlas-card-selected-border", "--atlas-card-size-lg-gap", "--atlas-card-size-lg-padding", "--atlas-card-size-md-gap", "--atlas-card-size-md-padding", "--atlas-card-size-sm-gap", "--atlas-card-size-sm-padding", "--atlas-card-title-foreground", "--atlas-focus-ring", "--atlas-font-sans", "--atlas-motion-state-duration", "--atlas-motion-state-easing", "--atlas-opacity-disabled", "--atlas-shadow-sm", "--atlas-spacing-1", "--atlas-spacing-control-gap", "--atlas-spacing-focus-offset", "--atlas-spacing-section-gap", "--atlas-spacing-text-gap", "--atlas-surface-raised", "--atlas-type-body-sm-line-height", "--atlas-type-body-sm-size", "--atlas-type-body-sm-weight", "--atlas-type-title-line-height", "--atlas-type-title-size", "--atlas-type-title-weight"],
  "figmaNodeId": "110:24",
  "figmaFileKey": "cKYhfaHLCoyMHi9nKr63Ig",
  "figmaProperties": {
    "Variant": ["default", "outlined", "elevated", "filled"],
    "Size": ["sm", "md", "lg"],
    "State": ["default", "hover", "focus-visible", "active", "disabled", "selected"]
  },
  "syncedAt": "2026-10-21T12:25:27.000Z",
  "figmaVersion": "lib:Atlas Design System v1@2026-07-06T03:44:45Z",
  "source": "figma-synced"
}
