{
  "_generated": "GENERATED — do not hand-edit. figma-synced 2026-10-21T12:25:27.000Z; regenerated by atlas-figma-sync.",
  "name": "Skeleton",
  "tier": "primitives",
  "status": "stable",
  "deprecated": null,
  "import": "@atlas/ui-web/primitives/Skeleton/Skeleton",
  "variants": [],
  "sizes": [],
  "props": [
    { "name": "shape", "required": false, "type": "SkeletonShape" }
  ],
  "subcomponents": [],
  "tokensUsed": ["--atlas-background-muted", "--atlas-duration-pulse", "--atlas-easing-standard", "--atlas-opacity-pulse", "--atlas-radius-full", "--atlas-radius-md", "--atlas-spacing-10", "--atlas-spacing-4"],
  "figmaNodeId": "531:5",
  "figmaFileKey": "cKYhfaHLCoyMHi9nKr63Ig",
  "figmaProperties": { "Shape": ["rect", "circle"] },
  "syncedAt": "2026-10-21T12:25:27.000Z",
  "figmaVersion": "lib:Atlas Design System v1@2026-07-06T03:44:45Z",
  "source": "figma-synced"
}
