{
  "_generated": "GENERATED — do not hand-edit. figma-synced 2026-10-10T17:05:52.269Z; regenerated by atlas-figma-sync.",
  "name": "Input",
  "tier": "primitives",
  "status": "stable",
  "deprecated": null,
  "import": "@atlas/ui-web/primitives/Input/Input",
  "variants": ["default", "filled", "unstyled"],
  "sizes": ["sm", "md", "lg"],
  "props": [
    { "name": "variant", "required": false, "type": "InputVariant" },
    { "name": "size", "required": false, "type": "InputSize" },
    { "name": "invalid", "required": false, "type": "boolean" },
    { "name": "loading", "required": false, "type": "boolean" },
    { "name": "leadingIcon", "required": false, "type": "React.ReactNode" },
    { "name": "trailingIcon", "required": false, "type": "React.ReactNode" },
    { "name": "prefix", "required": false, "type": "React.ReactNode" },
    { "name": "suffix", "required": false, "type": "React.ReactNode" }
  ],
  "subcomponents": [],
  "tokensUsed": ["--atlas-background-muted", "--atlas-border-width-1", "--atlas-border-width-2", "--atlas-duration-fast", "--atlas-duration-slow", "--atlas-easing-linear", "--atlas-easing-standard", "--atlas-focus-ring", "--atlas-font-sans", "--atlas-font-size-sm", "--atlas-foreground-muted", "--atlas-input-adornment-padding", "--atlas-input-affix-foreground", "--atlas-input-background", "--atlas-input-background-disabled", "--atlas-input-border", "--atlas-input-border-focus", "--atlas-input-border-hover", "--atlas-input-border-invalid", "--atlas-input-filled-background", "--atlas-input-filled-background-focus", "--atlas-input-filled-background-hover", "--atlas-input-foreground", "--atlas-input-foreground-disabled", "--atlas-input-icon-foreground", "--atlas-input-icon-size", "--atlas-input-placeholder", "--atlas-input-radius", "--atlas-input-size-lg-font-size", "--atlas-input-size-lg-height", "--atlas-input-size-lg-padding-inline", "--atlas-input-size-md-font-size", "--atlas-input-size-md-height", "--atlas-input-size-md-padding-inline", "--atlas-input-size-sm-font-size", "--atlas-input-size-sm-height", "--atlas-input-size-sm-padding-inline", "--atlas-opacity-disabled", "--atlas-radius-full", "--atlas-radius-none", "--atlas-spacing-0_5", "--atlas-spacing-10", "--atlas-spacing-12", "--atlas-spacing-3", "--atlas-spacing-4", "--atlas-spacing-5", "--atlas-spacing-8", "--atlas-touch-min"],
  "figmaNodeId": "43:111",
  "figmaFileKey": "cKYhfaHLCoyMHi9nKr63Ig",
  "figmaProperties": { "Variant": ["default", "filled", "unstyled"], "Size": ["sm", "md", "lg"], "State": ["default", "hover", "focus-visible", "disabled", "error"] },
  "figmaComponentProperties": {
    "Leading icon": { "type": "BOOLEAN", "default": false },
    "Trailing icon": { "type": "BOOLEAN", "default": false },
    "Leading icon slot": { "type": "INSTANCE_SWAP" },
    "Trailing icon slot": { "type": "INSTANCE_SWAP" }
  },
  "syncedAt": "2026-10-10T17:05:52.269Z",
  "figmaVersion": "lib:Atlas Design System v1@2026-07-06T03:42:12Z",
  "source": "figma-synced"
}
