{
  "_generated": "GENERATED — do not hand-edit. figma-synced 2026-10-21T12:25:27.000Z; regenerated by atlas-figma-sync.",
  "name": "Avatar",
  "tier": "primitives",
  "status": "stable",
  "deprecated": null,
  "import": "@atlas/ui-web/primitives/Avatar/Avatar",
  "variants": [],
  "sizes": ["xs", "sm", "md", "lg", "xl"],
  "props": [
    { "name": "shape", "required": false, "type": "AvatarShape" },
    { "name": "size", "required": false, "type": "AvatarSize" },
    { "name": "src", "required": false, "type": "string" },
    { "name": "alt", "required": false, "type": "string" },
    { "name": "initials", "required": false, "type": "string" },
    { "name": "icon", "required": false, "type": "React.ReactNode" },
    { "name": "showStatus", "required": false, "type": "boolean" },
    { "name": "statusLabel", "required": false, "type": "string" },
    { "name": "statusIndicator", "required": false, "type": "React.ReactNode" },
    { "name": "showBadgeIcon", "required": false, "type": "boolean" },
    { "name": "badgeIcon", "required": false, "type": "React.ReactNode" }
  ],
  "subcomponents": ["AvatarGroup"],
  "tokensUsed": ["--atlas-avatar-group-overlap", "--atlas-avatar-squircle-radius-lg", "--atlas-avatar-squircle-radius-md", "--atlas-avatar-squircle-radius-sm", "--atlas-avatar-squircle-radius-xl", "--atlas-avatar-squircle-radius-xs", "--atlas-background", "--atlas-background-muted", "--atlas-border-width-1", "--atlas-border-width-2", "--atlas-duration-base", "--atlas-duration-fast", "--atlas-easing-emphasized", "--atlas-easing-standard", "--atlas-focus-ring", "--atlas-font-sans", "--atlas-font-size-xs", "--atlas-font-weight-medium", "--atlas-foreground-muted", "--atlas-icon-size-md", "--atlas-icon-size-sm", "--atlas-icon-size-xs", "--atlas-line-height-tight", "--atlas-opacity-hover", "--atlas-primary", "--atlas-primary-foreground", "--atlas-radius-full", "--atlas-spacing-0", "--atlas-spacing-1", "--atlas-spacing-10", "--atlas-spacing-12", "--atlas-spacing-1_5", "--atlas-spacing-2", "--atlas-spacing-3", "--atlas-spacing-5", "--atlas-spacing-6", "--atlas-spacing-8", "--atlas-success", "--atlas-touch-min"],
  "figmaNodeId": "487:720",
  "figmaFileKey": "cKYhfaHLCoyMHi9nKr63Ig",
  "figmaProperties": { "Type": ["Image", "Text", "Icon"], "Size": ["xs", "sm", "md", "lg", "xl"], "Shape": ["circle", "squircle"] },
  "syncedAt": "2026-10-21T12:25:27.000Z",
  "figmaVersion": "lib:Atlas Design System v1@2026-07-06T03:44:45Z",
  "source": "figma-synced"
}
