{
  "_generated": "GENERATED — do not hand-edit. figma-synced 2026-10-21T12:25:27.000Z; regenerated by atlas-figma-sync.",
  "name": "CodeBlock",
  "tier": "compositions",
  "status": "stable",
  "deprecated": null,
  "owner": "@rizwan-uxd",
  "import": "@atlas/ui-web/compositions/CodeBlock/CodeBlock",
  "variants": ["default", "typing"],
  "sizes": ["sm", "md", "lg"],
  "props": [
    { "name": "code", "required": true, "type": "string" },
    { "name": "variant", "required": false, "type": "CodeBlockVariant" },
    { "name": "size", "required": false, "type": "CodeBlockSize" },
    { "name": "filename", "required": false, "type": "string" },
    { "name": "language", "required": false, "type": "string" },
    { "name": "showHeader", "required": false, "type": "boolean" },
    { "name": "showLineNumbers", "required": false, "type": "boolean" },
    { "name": "copyLabel", "required": false, "type": "string" },
    { "name": "onCopy", "required": false, "type": "(code: string) => void" },
    { "name": "duration", "required": false, "type": "number" },
    { "name": "delay", "required": false, "type": "number" },
    { "name": "writing", "required": false, "type": "boolean" },
    { "name": "onDone", "required": false, "type": "() => void" }
  ],
  "subcomponents": [],
  "tokensUsed": ["--atlas-border", "--atlas-border-subtle", "--atlas-border-width-1", "--atlas-border-width-2", "--atlas-duration-pulse", "--atlas-focus-ring", "--atlas-font-mono", "--atlas-font-sans", "--atlas-font-size-base", "--atlas-font-size-sm", "--atlas-font-size-xs", "--atlas-foreground", "--atlas-foreground-muted", "--atlas-foreground-subtle", "--atlas-icon-size-xs", "--atlas-line-height-relaxed", "--atlas-opacity-pulse", "--atlas-radius-sm", "--atlas-radius-surface", "--atlas-spacing-2", "--atlas-spacing-3", "--atlas-spacing-4", "--atlas-spacing-5", "--atlas-spacing-control-gap", "--atlas-spacing-px", "--atlas-spacing-surface-padding", "--atlas-surface", "--atlas-type-overline-letter-spacing", "--atlas-type-overline-line-height", "--atlas-type-overline-size", "--atlas-type-overline-weight"],
  "figmaNodeId": "731:108",
  "figmaFileKey": "cKYhfaHLCoyMHi9nKr63Ig",
  "figmaProperties": { "Variant": ["default", "typing"], "Size": ["sm", "md", "lg"] },
  "syncedAt": "2026-10-21T12:25:27.000Z",
  "figmaVersion": "lib:Atlas Design System v1@2026-07-06T03:44:45Z",
  "source": "figma-synced"
}
