{
  "_generated": "GENERATED — do not hand-edit. figma-synced 2026-10-21T12:25:27.000Z; regenerated by atlas-figma-sync.",
  "name": "Text",
  "tier": "primitives",
  "status": "stable",
  "deprecated": null,
  "import": "@atlas/ui-web/primitives/Text/Text",
  "variants": ["heading", "title", "body", "body-sm", "label", "caption", "overline"],
  "sizes": [],
  "props": [
    { "name": "variant", "required": false, "type": "TextVariant" },
    { "name": "tone", "required": false, "type": "TextTone" },
    { "name": "as", "required": false, "type": "TextElement" },
    { "name": "ref", "required": false, "type": "React.Ref<HTMLElement>" },
    { "name": "children", "required": true, "type": "React.ReactNode" }
  ],
  "subcomponents": [],
  "tokensUsed": ["--atlas-font-sans", "--atlas-foreground", "--atlas-foreground-muted", "--atlas-type-body-line-height", "--atlas-type-body-size", "--atlas-type-body-sm-line-height", "--atlas-type-body-sm-size", "--atlas-type-body-sm-weight", "--atlas-type-body-weight", "--atlas-type-caption-line-height", "--atlas-type-caption-size", "--atlas-type-caption-weight", "--atlas-type-heading-line-height", "--atlas-type-heading-size", "--atlas-type-heading-weight", "--atlas-type-label-line-height", "--atlas-type-label-size", "--atlas-type-label-weight", "--atlas-type-overline-letter-spacing", "--atlas-type-overline-line-height", "--atlas-type-overline-size", "--atlas-type-overline-weight", "--atlas-type-title-line-height", "--atlas-type-title-size", "--atlas-type-title-weight"],
  "figmaNodeId": "1120:31",
  "figmaFileKey": "cKYhfaHLCoyMHi9nKr63Ig",
  "figmaProperties": { "Variant": ["heading", "title", "body", "body-sm", "label", "caption", "overline"], "Tone": ["default", "muted"] },
  "figmaComponentProperties": {
    "Text": { "type": "TEXT" }
  },
  "syncedAt": "2026-10-21T12:25:27.000Z",
  "figmaVersion": "lib:Atlas Design System v1@2026-07-06T03:44:45Z",
  "source": "figma-synced"
}
