{
  "_generated": "GENERATED — do not hand-edit. figma-synced 2026-10-21T12:25:27.000Z; regenerated by atlas-figma-sync.",
  "name": "Alert",
  "tier": "compositions",
  "status": "stable",
  "deprecated": null,
  "owner": "@rizwan-uxd",
  "import": "@atlas/ui-web/compositions/Alert/Alert",
  "variants": ["info", "success", "warning", "danger", "neutral"],
  "sizes": ["sm", "md", "lg"],
  "props": [
    { "name": "variant", "required": false, "type": "AlertVariant" },
    { "name": "size", "required": false, "type": "AlertSize" },
    { "name": "title", "required": false, "type": "React.ReactNode" },
    { "name": "description", "required": false, "type": "React.ReactNode" },
    { "name": "icon", "required": false, "type": "React.ReactNode" },
    { "name": "hideIcon", "required": false, "type": "boolean" },
    { "name": "actions", "required": false, "type": "React.ReactNode" },
    { "name": "dismissible", "required": false, "type": "boolean" },
    { "name": "onDismiss", "required": false, "type": "() => void" },
    { "name": "className", "required": false, "type": "string" },
    { "name": "children", "required": false, "type": "React.ReactNode" }
  ],
  "subcomponents": [],
  "tokensUsed": ["--atlas-background-muted", "--atlas-border-subtle", "--atlas-border-width-1", "--atlas-border-width-2", "--atlas-danger", "--atlas-danger-muted", "--atlas-danger-subtle", "--atlas-duration-base", "--atlas-easing-exit", "--atlas-focus-ring", "--atlas-font-sans", "--atlas-font-size-base", "--atlas-font-size-lg", "--atlas-font-weight-semibold", "--atlas-foreground", "--atlas-foreground-muted", "--atlas-icon-size-sm", "--atlas-icon-size-xs", "--atlas-icon-stroke-sm", "--atlas-icon-stroke-xs", "--atlas-info", "--atlas-info-muted", "--atlas-info-subtle", "--atlas-line-height-tight", "--atlas-motion-enter-duration", "--atlas-motion-enter-easing", "--atlas-motion-exit-duration", "--atlas-motion-exit-easing", "--atlas-opacity-hover", "--atlas-radius-md", "--atlas-radius-sm", "--atlas-spacing-0_5", "--atlas-spacing-1", "--atlas-spacing-2", "--atlas-spacing-3", "--atlas-spacing-5", "--atlas-spacing-control-gap", "--atlas-spacing-focus-offset", "--atlas-spacing-section-gap", "--atlas-spacing-surface-padding", "--atlas-spacing-text-gap", "--atlas-success", "--atlas-success-muted", "--atlas-success-subtle", "--atlas-text-body", "--atlas-text-body-sm", "--atlas-text-caption", "--atlas-touch-min", "--atlas-type-body-sm-line-height", "--atlas-type-body-sm-size", "--atlas-type-body-sm-weight", "--atlas-warning", "--atlas-warning-muted", "--atlas-warning-subtle"],
  "figmaNodeId": "127:24",
  "figmaFileKey": "cKYhfaHLCoyMHi9nKr63Ig",
  "figmaProperties": { "Variant": ["info", "success", "warning", "danger", "neutral"], "Size": ["sm", "md", "lg"] },
  "syncedAt": "2026-10-21T12:25:27.000Z",
  "figmaVersion": "lib:Atlas Design System v1@2026-07-06T03:44:45Z",
  "source": "figma-synced"
}
